{"retrieval_id":"ret-fictional-001","query_hash":"sha256:query-fictional-0001","context_id":"ctx-fictional-001","index_id":"idx-fictional-001","config_hash":"sha256:config-fictional-0001","state":"SUFFICIENT","evidence":[{"evidence_id":"ev-fictional-001","chunk_id":"chk-fictional-001","version_id":"ver-fictional-001","index_id":"idx-fictional-001","rank":1,"score":0.99}],"created_at":"2026-08-13T00:00:00Z","completed_at":"2026-08-13T00:00:01Z"}
